{
	"schema_version": 1,
	"from_snapshot": "Svg11Rec20110816",
	"to_snapshot": "Svg2Cr20181004",
	"elements": {
		"added": [
			"feDropShadow"
		],
		"removed": []
	},
	"attributes": {
		"added": [
			"href",
			"method"
		],
		"removed": [
			"baseProfile",
			"clip",
			"glyph-orientation-horizontal",
			"version",
			"xlink:actuate",
			"xlink:href",
			"xlink:show",
			"xlink:title",
			"zoomAndPan"
		]
	}
}
